"ID","PG","txt"
7,38,"Achieve gender equality and empower all women and girls The social and economic impacts of the COVID19 pandemic have adversely affected progress towards gender equality Violence against women and girls has intensified child marriage on the decline in recent years is expected to increase and women have suffered a disproportionate share of job losses and increased care work at home The pandemic has highlighted the need to act swiftly to address pervasive global gender inequalities Women have played a central Women travel across Africa to take part in a sixmonth training role in the response to COVID19 as frontline health workers care programme to become solar engineers The photo above shows providers and as managers and leaders of recovery efforts Yet they graduates from Liberia and Malawi remain underrepresented in leadership positions and their rights and priorities are often not explicitly addressed in response and recovery measures The crisis presents an opportunity to reshape and rebuild systems laws policies and institutions to advance gender equality Violence against women persists at unacceptably high levels and has been intensified by the pandemic Nearly one in three women 736 million have been subjected to Global prevalence of physical andor sexual intimate partner violence against women by age group 20002018 percentage physical andor sexual violence at least once since the age of 15 30 usually by an intimate partner Intimate partner violence starts early 28 28 Among girls and women who have ever been married or had a partner 26 27 27 26 25 nearly 24 per cent of those aged 15 to 19 years have been subjected to 24 24 23 23 such violence as have 26 per cent of those aged 20 to 24 20 Disparities in intimate partner violence are found across regions 16 16 15 with consistently higher prevalence in low and lowermiddleincome 13 12 regions compared with highincome regions These variations are 10 10 likely to reflect the challenges that women often face in leaving 8 7 6 abusive relationships such as insufficient economic resources limited 5 4 availability and access to formal support services weak social support 0 1519 2024 2529 3034 3539 4044 4549 5054 5559 6064 65+ networks and fear of repercussions associated with social stigma Ever experienced intimate partner violence The current pandemic has heightened the challenges of women in Experienced intimate partner violence in the past 12 months abusive relationships COVID19 threatens global progress against The pandemic is adding to the burden of womens child marriage unpaid work while squeezing them out of the labour force Over the past decade the practice of child marriage has declined significantly with the global proportion of young women who were On an average day women spend about 25 times as many hours married as children decreasing by 15 per cent from nearly one in on unpaid domestic work and care work as men according to data four to one in five As a result the marriages of some 25 million girls from 90 countries and areas collected between 2001 and 2019 Both have been averted However the profound effects of the COVID19 women and men have increased their unpaid workloads during the pandemic are putting girls at higher risk of early marriage due to a crisis but women are doing a disproportionate share Moreover more combination of economic shocks school closures and interruptions in women than men are leaving the workforce to provide childcare In a reproductive health services Over the next decade up to 10 million 16country study the amount of time spent on childcare has increased more girls will be at risk of child marriage as a result of the pandemic for both women from 26 hours a week before the pandemic to in addition to the 100 million who were projected to become child 31 hours after and men from 20 hours a week to 24 hours Evidence brides before Most child marriages due to the pandemic are expected from Brazil Chile Costa Rica and Mexico shows that partnered to occur in the near term though the impact is likely to be felt for at women with children have experienced sharper drops in labour force least the next decade participation than men particularly women living with children under 6 years of age The Sustainable Development Goals Report 2021 36"
7,39,"Womens equal participation in decisionmaking crucial for COVID19 response and recovery remains a distant target The pandemic has exacerbated gender inequalities and threatens pandemics disproportional impact on women in the workforce and to undermine progress on womens empowerment More than ever especially on women entrepreneurs threatens to roll back the little women are needed as equal partners in crafting genderresponsive progress that has been made in reducing the global gender gap in laws policies and budgets to build back better and ensure a gender managerial positions transformative agenda in both private and public spheres However as of 1 January 2021 womens representation was far from parity Proportion of seats held by women in parliaments and local governments the global average of women in single or lower chambers of national 2000 and 2021 percentage parliaments was only 256 per cent and 363 per cent in local Oceania deliberative bodies continuing a slow upward trend At the current Northern Africa and Western Asia rate it will take no fewer than 40 years to achieve gender parity in Central and Southern Asia national parliaments Only 23 countries have at least 40 per cent Eastern and SouthEastern Asia female representation in their lower or single chambers of parliament SubSaharan Africa 22 countries in local government Most achieved such progress through the use of gender quotas In 2020 the share of parliamentary Europe and Northern America seats won by women in countries with legislated quotas was Latin America and the Caribbean 274 per cent compared with 156 per cent in countries with no World quota systems At the local level use of legislated quotas increased a countrys representation of women by 7 percentage points 0 10 20 30 40 50 Though women accounted for nearly 39 per cent of the global Parliament 2000 Parliament 2021 Local government 2021 labour force in 2019 they occupied only 282 per cent of managerial positions only 3 percentage points higher than in 2000 The Discriminatory laws and legal gaps continue to deprive women of their human rights Discriminatory laws and legal gaps continue to prevent women the principle of consent In the area of employment and economic from enjoying their full human rights based on data collected benefits over 90 per cent of countries mandated nondiscrimination in 95 countries across four areas of law in 2020 In the area of on the basis of gender in employment but almost half of them overarching legal frameworks and public life more than half of the continued to restrict women from working in certain jobs or countries with data lacked quotas for women in national parliaments industries In the area of marriage and family almost a quarter of and close to one fifth maintained discriminatory nationality laws countries failed to grant women equal rights with men to enter into In the area of violence against women 83 per cent of countries marriage and initiate divorce and three quarters of countries did not included budgetary commitments to implement legislation addressing stipulate 18 years as the minimum age of marriage for women and violence against women but 63 per cent lacked rape laws based on men with no exceptions Giving women equal access to land would go a long way towards alleviating poverty and food insecurity Womens ownership or control of land is critical to their economic Share of women and men in the adult agricultural population with ownership or secure rights over agricultural land selected countries percentage empowerment Land ownership gives rise to a host of benefits 80 for women through an increase in their bargaining power within 694 households and the economy These benefits are not limited to 653 598 608 women Studies suggest that if women had equal access to land 60 poverty and food insecurity would be significantly reduced around the 490 471 489 world 413 398 40 350 340 That vision is far from realized In most countries less than 297 310 303 50 per cent of women and men engaged in agriculture have ownership 186 20 or secure tenure rights over agricultural land In 9 of the 10 countries 80 assessed relatively few women have such rights compared to men 36 59 63 03 It is not always the case that landowners who are men outnumber 0 landowners who are women but this is by far the most common 14 14 19 19 7 16 f 16 18 12 09 20 o 01 20 20 20 20 20 20 20 ia lic 20 i2 an ub situation found in 7 out of the 10 countries for which data are a ia da ia ru r o aw a ge di s r op nz ep di Pe Fa an ge In Ni al bo Ta R hi Ug Ni a M available In five of these countries men outnumber women in land d Et m in ite rk Ca Un Bu ownership by at least two to one Africa Latin America Asia Men Women 37 Goal 5 | Gender equality"
7,40,"Ensure availability and sustainable management of water and sanitation for all Billions of people around the globe live without safely managed drinking water sanitation and hygiene services COVID19 has underscored the need for universal access to these services to combat the pandemic and promote a healthy green and sustainable recovery Water is required across all sectors of society to produce food energy goods and services Over the last century global water use has increased at more than twice the rate of population growth Over 100 households and 1600 schoolchildren now have Many water sources are drying up becoming more polluted or both better access to safe water in South Upi Maguindanao In addition to water stress and water pollution countries are facing Philippines thanks to a joint project by the International Labour growing challenges linked to degraded waterrelated ecosystems Organization and the Government of Japan water scarcity caused by climate change underinvestment in water and sanitation and insufficient cooperation on transboundary waters The world is not on track to achieve Goal 6 A dramatic acceleration in current rates of progress and integrated and holistic approaches to water management are badly needed Universal access to drinking water sanitation and hygiene is fundamental to the COVID19 response Between 2015 and 2020 the proportion of the global population using sanitation services and three in four had basic hygiene services in safely managed drinking water services increased from 702 per cent 2019 To ensure that we build back better from the COVID19 crisis to 743 per cent with the largest numbers of people gaining access Governments will need to accelerate their efforts to ensure access to in Central and Southern Asia Despite this progress another drinking water sanitation and hygiene for all 2 billion people still lacked safely managed drinking water in 2020 including 771 million werelayers whoguide Two different without even for two basic drinking and threeline titles water Global coverage of drinking water sanitation and hygiene services Guides for edge of rightaligned text and bars are uniform and account for Half of those lacking basic drinking space for other languages water services 387 million live 2015 and 2020 percentage Africaare of full 75 50 and 25 color in subSaharanSwatches Drinking water Sanitation Hygiene 100 2 2 theshould The proportionAllofbars globalbe 0p6 wide population using safely managed 5 6 9 9 with 0 spacing within country categories 6 10 sanitation services and 0p2increased 471 per fromcountry spacing between cent in 2015 to 54 per cent categories 3 4 8 in 2020 However 36 billion people still lacked If World LDC LDS or SIDS categories safely are spaced managed apart 10 0p6 spacing from main regions 16 7 21 80 sanitation in 2020 including 17 billion who were without even basic Number labels should be inside color bars ideally and 0p3 from edge 18 7 23 sanitation Of these people If outside 494and leftaligned million practised open defecation 0p3 away down from 739Numbermillionlinein0p2 bottomthe belowWhile 2015 world25pt bar Stroke is on track to 24 Tick marks 0p3 long Text 0p1 below tick mark eliminate open defecation by 2030 achieving universal access to 60 26 Legend categories rightaligned 1p0 apart 0p3 between color bubble and safely managedtextsanitation by 2030 will require a quadrupling of progress current rates ofLegend color bubble 0p6 Legend 0p6 below number line labels Any note 0p6 below legend The proportion of the global population with basic hygiene rose from 40 74 71 Note uses hanging indent 67 70 673 per cent in 2015 to 707 per cent in 2020 This means that at the start of the COVID19 pandemic 23 billion people worldwide one in 54 three still lacked a basic handwashing facility with soap and water at 20 47 home and 670 million had no handwashing facility at all Universal access to water sanitation and hygiene services goes well beyond household use Globally only two in three schools had basic 0 2015 2020 2015 2020 2015 2020 drinking water and sanitation services and three in five schools had basic hygiene services in 2019 This means that 818 million children Surface water Open defecation No facility Unimproved Unimproved Limited lacked basic handwashing facilities at their schools at the start of the Limited Limited Basic COVID19 pandemic In least developed countries only one in two Basic Basic healthcare facilities had basic water services two in five had basic Safely managed Safely managed The Sustainable Development Goals Report 2021 38"
7,41,"Water stress is getting worse in subregions with already high or critical levels When a country or territory withdraws 25 per cent or more of its Levels of water stress freshwater withdrawal as a proportion of available freshwater resources regions with high and very high water stress renewable freshwater resources it is water stressed This challenge 2015 and 2018 percentage affects countries on every continent In 2018 23 billion people lived in waterstressed countries of whom 721 million lived in countries with Northern Africa 1051 1085 high or critical levels Between 2015 and 2018 water stress in some Central Asia 767 795 subregions with already high or very high levels such as Northern 780 Southern Asia 777 Africa Central Asia and Western Asia increased by over 2 per cent 579 Western Asia 602 Improving wateruse efficiency is one key to reducing water stress 456 Eastern Asia Wateruse efficiency worldwide rose 10 per cent from $1730 per 456 cubic metre in 2015 to $1900 per cubic metre in 2018 All economic World 182 184 sectors have seen their wateruse efficiency improve since 2015 0 20 40 60 80 100 120 with a 15 per cent increase in industry 8 per cent in agriculture and 2015 2018 8 per cent in the service sector More concrete measures are needed to save water and increase wateruse efficiency particularly in those regions that have or are close to having a high to critical level of water stress above 75 per cent Freshwater ecosystems are changing dramatically signalling the need for an urgent response Waterrelated ecosystems play a fundamental ecological role and Loss of inland wetlands over three centuries 17002020 percentage and coastal mangrove area 19962016 thousands of square kilometres provide essential products and services That said freshwater ecosystems are changing dramatically One fifth of the worlds river 100 143 139 150 100 138 136 Inland wetland change percentage since 1700 basins are experiencing either rapid increases or decreases in surface water area Globally lakewater quality is poor of the 2300 large lakes 80 120 thousands of square kilometres assessed in 2019 nearly a quarter recorded high to extreme turbidity 76 water cloudiness High turbidity can adversely impact human and Coastal mangrove 60 90 ecosystem health An assessment of 10 per cent of the worlds large lakes in 2019 showed that at least 21 million people including 5 million children live within a 5kilometre radius of lakes with high turbidity 40 44 60 Natural wetlands around the world are in longterm decline More than 80 per cent are estimated to have been lost since the preindustrial 20 30 era Between 1970 and 2015 inland and marinecoastal wetlands each shrank by approximately 35 per cent three times the rate of 13 12 0 0 forest loss The area covered by coastal mangroves declined globally 1700 1800 1900 1996 2000 2007 2010 2016 2020 by 49 per cent between 1996 and 2016 Efforts to protect and restore Inland wetland Mangrove waterrelated ecosystems must be urgently scaled up and accelerated Ensuring that operational arrangements cover all Countries are lagging in the implementation of transboundary water basins by 2030 will require a integrated management of water resources central major acceleration in effort to a sustainable future Transboundary water cooperation is crucial to encouraging regional To balance competing demands for water many countries integration promoting peace and sustainable development have strengthened water laws developed relevant policies and tackling regional security challenges and supporting climate change reinforced institutions Globally the average implementation rate adaptation Globally 153 countries share rivers lakes and aquifers for the integrated management of water resources increased However only 24 countries had all of their transboundary basin area from 49 per cent in 2017 to 54 per cent in 2020 The current rate covered by operational arrangements in 2020 22 countries had more of progress needs to double as 129 countries are not on track to than 70 per cent covered On average 58 per cent of transboundary achieve sustainable management of water resources by 2030 To basin areas have an operational arrangement for water cooperation accelerate progress countries must build on their multistakeholder Europe and Northern America and subSaharan Africa show the monitoring processes to understand major barriers and identify greatest coverage priority actions In many countries COVID19 has actually led to In 2020 despite the COVID19 pandemic 128 out of 153 countries wider stakeholder engagement in water resources management sharing transboundary basins submitted national reports on the through online consultations Some of the most common priorities status of their cooperative arrangements More efforts are needed include establishing sustainable financing mechanisms and improving to accelerate progress so that all transboundary rivers lakes and management and monitoring of basins and aquifers on the basis of aquifers are covered by operational agreements by 2030 hydrological rather than administrative boundaries 39 Goal 6 | Clean water and sanitation"
7,42,"Ensure access to affordable reliable sustainable and modern energy for all Over the last decade access to electricity has expanded use of renewable energy in the electricity sector has increased and energy efficiency has improved Still millions of people are without electricity and one third of the global population lack clean cooking fuels and technologies Progress in ensuring energy access has been uneven across regions leaving the most vulnerable even further behind The pandemic is reversing progress and causing millions of people Solar energy systems in rural Rwanda are electrifying homes to lose access to electricity Moreover depressed oil and gas prices primarily benefiting women and children are likely to discourage uptake of clean energy technologies On the positive side lower fossil fuel prices provide an opportunity for Governments to reform fossil fuel subsidies Stimulus plans designed to boost economic growth protect workers and create jobs could scale up the deployment of clean energy technologies The lights are going out in parts of Africa and Asia due to the effects of growing poverty The global electricity access rate improved from 83 per cent in 2010 Proportion of population with access to electricity 2010 and 2019 percentage to 90 per cent in 2019 with 11 billion people receiving electricity for SubSaharan Africa 33 46 the first time However 759 million people were still without access Oceania 36 70 in 2019 with three quarters of them in subSaharan Africa 97 million 91 Northern Africa and Western Asia 94 in urban areas and 471 million in rural areas At the current pace 75 Central and Southern Asia 95 660 million people will still be without electricity in 2030 the vast 96 Latin America and the Caribbean 98 majority of whom 555 million will be in subSaharan Africa 96 Eastern and SouthEastern Asia 98 The COVID19 pandemic could reverse progress in some countries 100 Australia and New Zealand 100 In Africa the number of people without electricity increased in 2020 100 Europe and Northern America 100 after declining over the previous six years In developing countries in 83 Africa and Asia basic electricity services are now unaffordable for World 90 more than 25 million people who had previously gained access due 0 20 40 60 80 100 to population growth and increasing levels of poverty An additional 2010 2019 85 million people mainly in developing countries in Asia may be Excluding Australia and New Zealand forced to scale back to basic electricity access because of an inability to pay for an extended bundle of services At the current rate of progress one third of the worlds population will still be using dangerous and inefficient cooking systems in 2030 In 2010 57 per cent of the global population were using clean cooking Share of the population with access to clean cooking systems 2019 percentage fuels and technologies rising to 66 per cent in 2019 This means that 26 billion people have been left behind In subSaharan Africa population increases outstripped growth in access leaving about 85 per cent of the population reliant on inefficient and dangerous cooking systems The majority of the poor rely on harmful and polluting fuels such as wood and charcoal to cook making them especially vulnerable to COVID19 Meanwhile the pandemic and resulting lockdowns threaten to derail progress Unless rapid action is taken one third of the global population will still be without clean cooking fuels and technologies in 2030 resulting in significant adverse health effects and environmental degradation 0 to 249 25 to 499 50 to 749 75 to 999 100 No data Note The boundaries and names shown and the designations used on this map do not imply official endorsement or acceptance by the United Nations The Sustainable Development Goals Report 2021 40"
