"ID","PG","txt"
7,53,"Electronic waste continues to proliferate and is not being disposed of in a responsible way In 2019 the world generated 536 million metric tons of electronic Ewaste generated and recycled 20102019 projected ewaste generated and and electrical equipment waste ewaste an increase of more than required growth in recycling 20202030 kilograms per capita 20 per cent since 2014 Each person generated about 73 kilograms 10 90 of ewaste in 2019 of which only 17 kilograms was documented to 82 8 have been managed in an environmentally sustainable way Improper 73 disposal of ewaste causes poisonous chemicals to be released into 6 57 53 the soil and water putting environmental and human health at risk It results in a significant loss of scarce and valuable raw materials 4 such as gold platinum cobalt and rare earth elements As much as 17 7 per cent of the worlds gold may currently be contained in ewaste 2 12 Ewaste generation is expected to grow by 016 kilograms per capita 0 annually reaching 90 kilograms per capita in 2030 or 744 million 2010 2019 2020 2025 2030 metric tons in total However the realized annual growth rate of Ewaste generated Ewaste generated projected growth rate ewaste recycling in the past decade was only 005 kilograms per Ewaste recycled Ewaste recycled required rate capita It will need to be at least 10 times higher to ensure recycling of all ewaste by 2030 Progress to eliminate fossil fuel subsidies remains uneven threatening the achievement of the Paris Agreement and 2030 Agenda Fossil fuel subsidies from Governments provide incentives to produce Fossil fuel subsidies as a proportion of GDP 2015 and 2019 percentage and consume fossil fuels such as coal crude oil and natural gas Central and Southern Asia 29 30 over the development and use of clean and renewable energy They Northern Africa and Western Asia 34 24 contribute to the climate crisis and air pollution and negatively 10 SubSaharan Africa 11 impact public health Fossil fuel subsidies saw a decline in 2019 to 063 Latin America and the Caribbean 058 $432 billion due to lower fuel prices breaking an upward trend from 03 Australia and New Zealand 2017 $450 billion and 2018 $548 billion Subsidies were expected 05 Oceania 0305 to decline sharply in 2020 due to cratering demand and the oil price shock That drop in fossil fuel subsidies measured as a proportion Eastern and SouthEastern Asia 02 02 03 of GDP is likely to be smaller than expected however due to a Europe and Northern America 02 simultaneous decrease in GDP worldwide in 2020 With lower fuel Least developed countries 11 12 prices over the last two years many countries took the opportunity to 04 Small island developing States 03 press for reforms and phase out subsidies However progress remains World 06 05 uneven With fuel prices rising sharply in 2021 there is also a danger 0 1 2 3 4 of regressing and failing to meet the commitments made in the 2030 2015 2019 Agenda for Sustainable Development and the Paris Agreement Despite progress developing countries still have vast untapped potential for renewable energy Globally new renewable electricity capacity installations witnessed Installed renewable energygenerating capacity in developing countries remarkable development over the past decade outpacing installations by technology between 2010 and 2019 watts per capita 250 in nonrenewable electricity capacity since 2012 and consistently 219 since 2015 In 2018 for the first time the majority of new renewable 205 200 188 electricity capacity was installed in developing countries The 171 significant increase in capacity in these countries can be attributed 156 150 142 primarily to the uptake of new solar and wind capacity which 129 117 110 increased by a compound annual growth rate of 72 per cent and 102 100 22 per cent respectively from 2010 to 2019 The most recent data show that renewable energy capacity continued to grow at an even 50 higher level in 2020 despite COVID19 In 2019 developing countries had 219 watts per capita of renewable 0 energy capacity However renewable energy capacity was 880 watts 2010 2011 2012 2013 2014 2015 2016 2017 2018 2019 per capita in developed countries four times higher than that of Renewable hydropower Wind energy Solar energy developing countries suggesting there is still room for growth Bioenergy geothermal and marine energy 51 Goal 12 | Responsible consumption and production"
7,54,"Take urgent action to combat climate change and its impacts Despite a pandemicrelated economic slowdown the climate crisis continues largely unabated A temporary reduction in human activities resulted in a dip in emissions However concentrations of greenhouse gases continued to increase in 2020 reaching new record highs It was one of the three warmest years on record with the global average temperature about 12°C above the 18501900 baseline The world remains woefully off track in meeting the Paris Agreement target An aerial view of disappearing ice at the summit of Mount of limiting global warming to 15°C above preindustrial levels and Kilimanjaro in the United Republic of Tanzania reaching netzero carbon dioxide CO2 emissions globally by 2050 In the face of looming catastrophe climate action is gaining momentum In June 2020 the Race to Zero campaign was launched The global pandemic has laid bare humanitys vulnerabilities It has to form a coalition of businesses cities regions and investors around shown the world how much damage can be wreaked by a crisis that netzero carbon emission initiatives and set out specific nearterm pales in comparison to a fullscale climate emergency We must heed tipping points for more than 20 sectors of the global economy As this wakeup call and seize the opportunity to rebuild in a way that will of December 2020 over two thirds of the worlds GDP was being reduce emissions and increase resilience to climate change generated in places with actual or intended net zero by 2050 targets covering over half of the worlds population and emissions Greenhouse gas emissions will continue to increase without critical steps to shift economies towards carbon neutrality In 2015 196 Parties to the Paris Agreement committed to Concentrations of carbon dioxide 19592020 parts per million transforming their development trajectories towards sustainability 420 and called for limiting global warming to well below 2°C ideally 400 15°C above preindustrial levels To meet these goals global carbon 380 dioxide emissions need to be reduced by 45 per cent by 2030 from 2010 levels and reach netzero emissions by 2050 Greenhouse gas 360 concentrations reached new highs in 2020 with globally averaged 340 mole fractions of CO2 exceeding 410 parts per million 320 The COVID19 pandemic significantly reduced human activities 300 in 2020 leading to a temporary fall in CO2 emissions Developed 1959 1970 1980 1990 2000 2010 2020 countries saw the steepest declines averaging drops of almost 10 per cent while emissions from developing countries fell by 4 per cent relative to 2019 Despite the temporary reduction in Monthly evolution of global CO2 emissions 2020 relative to 2019 percentage emissions overall in 2020 realtime data from specific locations 5 including Mauna Loa United States and Cape Grim Tasmania 0 indicate that concentration levels of CO2 methane and nitrous oxide continued to increase in 2020 By December 2020 emissions had 5 fully rebounded and registered 2 per cent higher than the same 10 month in 2019 As the world recovers from the pandemic emissions are expected to rise further unless critical steps are taken to shift 15 economies towards carbon neutrality 20 Jan Feb Mar Apr May Jun Jul Aug Sep Oct Nov Dec The Sustainable Development Goals Report 2021 52"
7,55,"Notwithstanding a global pandemic countries are advancing climate action with a focus on adaptation The voluntary efforts countries are making to reduce national Priority areas identified in adaptation components of nationally determined emissions and adapt to the impacts of climate change are described contributions among countries that included adaptation information 2020 percentage in their nationally determined contributions NDCs Each Party to the Paris Agreement is requested to prepare communicate and Ocean ecosystems 33 maintain successive NDCs that it intends to achieve As of May 2021 192 Parties had submitted their first NDCs to the Framework Urban areas and other human habitats 54 Convention on Climate Change secretariat Moreover as of Disaster risk management 54 December 2020 48 of them were submitted as new or updated NDCs representing 75 Parties and accounting for 30 per cent of Coastal and lowlying areas 54 global greenhouse gas emissions in 2017 Adaptation information was included in 39 of these 48 new or updated NDCs Countries are Key economic sectors and services 77 articulating more quantified targets and indicators for adaptation and identifying links between adaptation the Sustainable Development Human health 79 Goals and other frameworks The highestpriority areas for adaptation Freshwater resources 79 identified in the NDCs are food security and production terrestrial and wetland ecosystems freshwater resources human health and Terrestrial and wetland ecosystems 90 key economic sectors and services An increasing number of countries are also prioritizing the formulation Food production and nutritional security 90 and implementation of national adaptation plans to boost their 0 20 40 60 80 100 efforts to adjust to a changing climate These include building flood defences setting up early warning systems for cyclones or switching to droughtresistant crops As of May 2021 125 of 154 developing countries were in the process of formulating and implementing national adaptation plans and 22 countries have submitted their plans to the Framework Convention on Climate Change secretariat Developed countries are stepping up their efforts to provide technical guidance and support to LDCs which are particularly vulnerable to the effects of climate change to develop and carry out such plans The global transition to a lowemission climateresilient future is backed up by increasing financial support Climate finance provided by developed to developing countries Total financial support provided as reported by Annex I Parties to the Framework Convention on Climate Change secretariat 20112018 billions of dollars continues to increase reflecting an ongoing commitment to support 60 the global transition to a lowemission and climateresilient future Total climate finance reported by Annex I Parties to the Paris Agreement reached an annual average of $487 billion in 20172018 50 135 This represents an increase of 10 per cent over 20152016 While over half of all climatespecific financial support for 20172018 was 119 115 40 targeted at mitigation the share of adaptation support is growing 124 and many countries are prioritizing adaptation in their provision of 166 151 financial support 30 Two thirds of financial support provided in 20172018 equivalent to an annual average of $323 billion flowed through bilateral regional 118 118 417 and other channels while the remaining third was channelled through 20 375 370 330 multilateral institutions and funds such as the Green Climate Fund 254 266 GCF Support for the formulation of national adaptation plans 10 through the GCF Readiness Programme is steadily increasing in all 170 171 regions and groups Eleven developing countries have submitted 23 project proposals to the GCF of which 7 totalling $464 million 0 2011 2012 2013 2014 2015 2016 2017 2018 have been approved Climatespecific support Coregeneral support In 20172018 climatespecific support constituted the largest share of total climate finance $362 billion The share of core general support financial support provided to multilateral and bilateral institutions that is not considered climatespecific has been decreasing over time from over 40 per cent of the total in 20112012 to roughly 25 per cent in 20172018 53 Goal 13 | Climate action"
7,56,"Conserve and sustainably use the oceans seas and marine resources for sustainable development More than 3 billion people rely on the ocean for their livelihoods and over 80 per cent of world merchandise trade is carried out by sea Oceans contribute to poverty eradication sustained economic growth and food security However the benefits they provide are increasingly undermined by human activities Rising CO2 emissions are driving ocean warming acidification and deoxygenation which threaten marine ecosystems and the people who depend on them and are Local fishers in the Caribbean are benefiting from a project overwhelming the capacity of oceans to moderate climate change to help regenerate the marine ecosystem manage marine Overfishing depletes fish stocks a third of which are already resources while improving the fisheries market and develop overexploited Landbased pollutants including plastic pollution coastal ecotourism and nutrient and sewage runoff adversely affect coastal habitats and communities These changes have longterm repercussions that require urgent scaling up of protection of marine environments investment in ocean science and support for smallscale fishing communities and the sustainable management of the oceans The sustainability of our oceans demands renewed efforts to safeguard key biodiversity areas The extent of marine protected areas has increased significantly Safeguarding KBAs remains crucial to the sustainability of oceans A with 2020 coverage reaching 774 per cent of global coastal waters recent example from the South Atlantic used satellite tracking data and oceans The 10 per cent target set for 2020 may still be met for 14 species of seabirds and seals to pinpoint breeding grounds and because several sites planned for designation in 2020 were delayed feeding sites crucial to the preservation of these and other species Between 2000 and 2020 the mean percentage of key biodiversity This information was used to revise the management of a marine areas KBAs covered by protected areas grew from 28 per cent to protected area by extending the closure of fisheries by two months 44 per cent However increases have plateaued and coverage rose by and expanding several permanent nofishing zones while allowing only 1 percentage point over the last five years On average over half commercial fishing to occur in a regulated manner of each KBA remains outside of any form of protection The number of dead zones in the worlds coastal waters is growing at an alarming rate Coastal areas home to almost 40 per cent of the worlds population Efforts to reduce nutrient inputs into coastal areas are yielding face growing risks from eutrophication excess nutrient loading into results in some regions however algal blooms suggest that coastal coastal environments resulting from human activities The primary eutrophication remains a challenge drivers of eutrophication are fertilizer runoff livestock waste sewage discharge aquaculture and atmospheric nitrogen emissions Eutrophication and resulting impacts Coastal eutrophication is detrimental to the environment and coastal populations and is associated with harmful algal blooms hypoxia fish kills seagrass dieoff loss of coral reef and nearshore hardbottom habitats and health hazards to swimmers and fishers The number Block sunlight of dead zones worldwide areas of water that lack sufficient oxygen to support marine life increased from around 400 in 2008 to approximately 700 in 2019 Algal bloom + phytoplankton Changes in eutrophication can be indirectly monitored by analysing Phosphorus sunlight algal growth and chlorophylla the pigment that makes plants and and algae green Global satellite data show that countries exclusive Nitrogen economic zones have higher levels of chlorophylla compared with baseline values from 20002004 Still there are some signs of Agricultural runoff and other pollutants which contain nutrients are flushed into the ocean by rains or drainage causing phytoplankton and algae to grow and bloom on the surface progress the frequency of chlorophylla anomalies in countries reducing water quality This algal bloom can block sunlight from penetrating the water inhibiting exclusive economic zones fell by 20 per cent from 2018 to 2020 photosynthesis of the plant life below and eventually killing it The dying algae and decomposing plants consume oxygen through decomposition leaving the water with little oxygen a state of hypoxia and devastating the ecosystem The Sustainable Development Goals Report 2021 54"
7,57,"Implementation of international instruments to conserve and responsibly use ocean resources remains uneven highlighting the need for increased support Achieving Goal 14 requires the implementation of international Voluntary Guidelines for Securing Sustainable SmallScale instruments through legal and institutional frameworks for the Fisheries in the Context of Food Security and Poverty Eradication conservation and sustainable use of oceans in a crosssectoral and The Voluntary Guidelines are an internationally agreed instrument integrated manner While progress has been made implementation that promotes improved governance of smallscale fisheries varies among the instruments highlighting the need for renewed including in value chains postharvest operations and trade About effort and increased support half of countries worldwide have adopted specific initiatives to 1982 United Nations Convention on the Law of the Sea UNCLOS support smallscale fishers Such fishers contribute about half of and its implementing agreements global fish catches in developing countries and employ more than 90 per cent of the worlds capture fishers and fish workers about To date 168 Parties including the European Union have ratified half of whom are women These smallscale fishing communities or acceded to UNCLOS In addition Member States have also are largely marginalized and tend to have limited or disadvantaged ratified or acceded to its implementing agreements 150 Parties access to resources and markets The situation is compounded by for the 1994 Part XI Agreement and 91 Parties for the 1995 United the COVID19 crisis which has triggered reduced global demand and Nations Fish Stocks Agreement A large number of States Parties transportation restrictions to these treaties have taken steps to implement them through legal policy and institutional frameworks However the extent of Since 2015 most regions have expanded the adoption of regulatory ratification accession and implementation varies by country Data frameworks that support smallscale fisheries and promote collected in 2021 from 45 States and the European Union show that in participatory decisionmaking Globally the average composite score terms of ratification and accession 84 per cent of the countries score for implementation of these frameworks improved from 35 to 45 very high or high and 16 per cent score low or very low with regard between 2018 and 2020 At the regional level Northern Africa and to implementation 69 per cent score very high or high 12 per cent Western Asia reflects this leap while Central and Southern Asia score medium and 19 per cent score low or very low Effectively reduced its regional score from 35 to 25 highlighting the need for implementing UNCLOS and its implementing agreements requires redoubled efforts While countries commitment is gaining traction understanding existing bottlenecks for countries Targeted and increased support for smallscale fishers is critical in light of the sustained capacitydevelopment initiatives particularly for developing coronavirus pandemic countries are key to removing such obstacles Degree of implementation of international instruments to promote and protect Agreement on Port State Measures to Prevent Deter and smallscale fisheries 20182020 Eliminate Illegal Unreported and Unregulated Fishing Australia and New Zealand Fisheries resources are frequently poached leading to the collapse Central and Southern Asia of local fisheries and undermining efforts to manage fisheries Eastern and SouthEastern Asia sustainably Part of the framework developed over the past decades to Europe and Northern America combat illegal unreported and unregulated IUU fishing includes the Latin America and the Caribbean Agreement on Port State Measures the first binding international Oceania agreement that specifically targets IUU fishing The Agreement SubSaharan Africa came into force in 2016 and currently includes 66 Parties including the European Union Its objective is to prevent deter and eliminate Northern Africa and Western Asia IUU fishing by preventing vessels engaged in it from using ports and Least developed countries landing their catches Between 2018 and 2020 the average degree of Small island developing States implementation of international instruments to combat IUU fishing World improved with the global composite measure rising from 35 to 0 1 2 3 4 5 45 over this period This slight improvement in the global trend 2018 2020 helps bring the target of eliminating IUU fishing closer to being met Excluding Australia and New Zealand However more concerted efforts are needed Funding for marine research pales in comparison to the enormous economic contribution of the worlds oceans Marine research can be expensive and logistically challenging The United States of America reported the highest budget for ocean requiring advanced technologies and equipment research vessels and and coastal activities a figure that includes ocean science as well specially designed sensors and facilities However the proportion of as other ocean and coastal government programmes $12 billion gross domestic expenditure on research and development devoted followed by Japan $600 million and Australia $511 million in 2017 to ocean science is decidedly smaller than that of other major fields The full impact of the COVID19 pandemic on ocean science is still of research and innovation On average only 12 per cent of national unknown Immediate effects have included dramatic reductions in research budgets were allocated for ocean science between 2013 and ocean observations with almost all research vessels called to home 2017 with shares ranging from around 002 per cent to 95 per cent ports Mooring arrays buoys and moored systems with instruments This proportion is miniscule compared with the modestly estimated and communication equipment are at risk of failure threatening $15 trillion contribution of the ocean to the global economy in 2010 longlasting repercussions for international ocean research 55 Goal 14 | Life below water"
