"ID","PG","txt"
7,28,"End poverty in all its forms everywhere The effects of the coronavirus disease 2019 COVID19 pandemic have reversed much of the progress made in reducing poverty with global extreme poverty rising in 2020 for the first time since the Asian financial crisis of the late 1990s Even before COVID19 the world was not on track to achieve the goal of ending poverty by 2030 and without immediate and significant action it will remain beyond reach The crisis has demonstrated more clearly than ever the importance of disaster The Alimata family live in the Centre region of Burkina Faso The preparedness and robust social protection systems While the number parents work 103 hours a week to pay for food Their oneroom of countries with disaster risk reduction strategies has increased home has no electricity or toilet and they spend 35 hours a substantially and many temporary social protection measures have week collecting water They use charcoal and wood as fuel for been put in place in response to the pandemic increased efforts are their stove needed on both fronts to ensure the most vulnerable are protected COVID19 has led to the first rise in extreme poverty in a generation Before the COVID19 pandemic the share of the worlds population projections the global poverty rate is expected to be 7 per cent living in extreme poverty fell from 101 per cent in 2015 to 93 per cent around 600 million people in 2030 missing the target of eradicating in 2017 This means that the number of people living on less than poverty $190 per day dropped from 741 million to 689 million However the rate of reduction had slowed to less than half a percentage point Number of people living below $190 a day 20152017 20182020 nowcast and forecast before and after COVID19 millions annually between 2015 and 2017 compared with one percentage 751 point annually between 1990 and 2015 800 741 738 689 The pandemic has compounded the threats to progress raised by 645 733 731 conflict and climate change Estimates suggest that 2020 saw an 600 614 increase of between 119 million and 124 million global poor of whom 588 60 per cent are in Southern Asia Nowcasts point to the first rise in 400 the extreme poverty rate since 1998 from 84 per cent in 2019 to 2015 2017 2019 2020 2021 forecast 95 per cent in 2020 undoing the progress made since 2016 The Forecast before COVID19 COVID19 baseline COVID19 downside impacts of the pandemic will not be shortlived Based on current projection projection Working poverty disproportionately affects women and youth and the pandemic is likely to magnify those disparities The share of the worlds workers living in extreme poverty fell by Proportion of employed population living below $190 a day 2019 percentage more than half from 2010 to 2019 from 14 per cent to 66 per cent 40 348 However lockdowns and related public health measures due to 305 COVID19 have severely affected the informal economy where the vast 30 292 majority of the working poor are employed The related income losses threaten to roll back global progress on reducing working poverty 20 363 Although the gender gap in working poverty globally has narrowed 335 335 326 283 268 120 over the years a substantial gap persists in many parts of the world 10 particularly in the least developed countries LDCs There one third 66 130 58 114 335 per cent of employed women were living in poverty in 2019 71 63 62 55 0 compared with 283 per cent of employed men Worldwide young Total Youth Adults Total Youth Adults workers are twice as likely to be living in poverty as adults reflecting Least developed countries World lower earnings and poorer quality jobs Since the COVID19 crisis has Women Men Total had a disproportionate impact on the livelihoods of women and young people it is likely to exacerbate these longstanding disparities The Sustainable Development Goals Report 2021 26"
7,29,"Governments have put new social protection measures in place but most are only temporary Social protection measures are fundamental to preventing and Proportion of total population effectively covered by at least one social reducing poverty across the life cycle Nevertheless by 2020 only protection benefit and vulnerable persons covered by social assistance by incomelevel of country 2020 or latest available year percentage 469 per cent of the global population were effectively covered by at 100 least one social protection cash benefit leaving as many as 4 billion people without a social safety net The COVID19 crisis has 80 854 demonstrated the importance of social protection systems to protect peoples health jobs and incomes as well as the consequences of 60 628 640 high coverage gaps As a result many new social protection measures were introduced in 2020 between 1 February and 31 December 40 469 the Governments of 209 countries and territories announced more 344 than 1600 such measures in response to the crisis but almost all 20 289 249 947 per cent were short term in nature 152 134 78 Before the pandemic most of the population 854 per cent in 0 World Highincome Uppermiddle Lowermiddle Lowincome highincome countries was effectively covered by at least one social countries income income countries countries countries protection benefit compared with just over one tenth 134 per cent in lowincome countries The coverage gap is even greater for those Population covered by Vulnerable persons covered by at least one social protection benefit social assistance considered vulnerable only 78 per cent of whom were covered by social assistance in lowincome countries Good results from a global initiative to reduce disaster risk could be undermined by the pandemic Disasters and their immediate impacts threaten to reverse Number of countries with national andor local disaster risk reduction development gains and slow poverty reduction and hunger alleviation strategies 20152020 Based on the latest reporting under the Sendai Framework monitoring 100 89 process direct economic losses of $704 billion due to disasters were 80 reported by 53 countries for 2019 of which 60 per cent $425 billion 74 67 were recorded in the agricultural sector 60 56 In 2019 over 24000 deaths were attributed to disasters in 67 countries This is a substantial reduction from 2018 when disaster 37 40 40 mortality peaked at 126000 reported by 79 countries and is 27 29 consistent with an overall trend of declining mortality since 2005 18 20 14 However COVID19 is already reversing this progress overwhelming 8 10 4 5 3 2 2 health systems and highlighting underlying socioeconomic 3 0 vulnerabilities to biological hazards 2015 2016 2017 2018 2019 2020 The adoption and implementation of robust multihazard disaster Both Only national Only local risk reduction strategies which incorporate biological risks such as COVID19 are critical As of April 2020 120 countries reported that they had developed and adopted national andor local disaster risk reduction strategies up from 48 during the Sendai Frameworks nascent period in 2015 27 Goal 1 | No poverty"
7,30,"End hunger achieve food security and improved nutrition and promote sustainable agriculture Just prior to the COVID19 pandemic 650 million people were going hungry and some 2 billion people were suffering from food insecurity figures that had been rising since 2014 The crisis has posed additional threats to global food security and nutrition Disrupted food supply chains and economic slowdowns have affected food systems worldwide and threatened peoples access to food making the target of ending hunger even more distant COVID19 is expected to Students in the Lao Peoples Democratic Republic get at least exacerbate all forms of malnutrition particularly in children due to a one third of their daily energy and nutrition needs filled through loss of household income a lack of available and affordable nutritious a national school feeding programme In poor rural areas food reduced physical activity and disruptions in essential nutrition parents farm early in the morning and often dont have time to services Even discounting the effects of COVID19 around 230 prepare school lunches for their children million children suffer from malnutrition Urgent shortterm actions are needed to avert rising hunger and a transformation of food systems is required to achieve a healthy and sustainable food future for all COVID19 is pushing rising rates of hunger and food insecurity even higher COVID19 has had a further and profound impact on hunger and food moderate or severe food insecurity being 10 per cent higher among security triggered by disruptions in food supply chains income losses women than men in 2020 compared with 6 per cent in 2019 widening social inequities an altered food environment and price hikes BetweenTwo720 and 811 different million guide people layers for inthreeline two and the world faced hunger titles Number and proportion of undernourished people in the world 20052020 Guides for edge of rightaligned text and bars are uniform and account for in 2020 an increase ofother as many as 161 million from 2019 millions and percentage space for languages 1000 18 The prevalenceSwatches are of full 75 50 and 25 color of undernourishment increased from 84 per cent All bars should be 0p6 wide 16 Proportion of undernourished people withcent in 2019 to 99 per in 2020 Hunger affects 210 per cent of 8107 7680 Millions of undernourished people 0 spacing within country categories 800 14 the population and 0p2 spacing in Africa between country compared categories with 90 per cent in Asia and 6368 If World LDC LDS or SIDS categories are spaced apart 6503 12 91 per cent in Latin America and the 0p6 spacing from main regions Caribbean More than half of the 6151 600 124 worlds undernourished Number labels are found should in Asia be inside 418 color million bars ideally and and 0p3 more than from edge 10 If outside leftaligned and 0p3 away onethird in Africa 282 million 92 84 99 8 Number line 0p2 below bottom bar Stroke 25pt 400 83 security Achieving foodTick goes marks 0p3 beyond long Text 0p1the beloweradication tick mark of hunger 6 Legendpeople Nearly one in three the world 237 in rightaligned categories billion 1p0 apart were color affected 0p3 between bubble and 200 4 text by moderate or severe food insecurity in 2020 an increase of almost 2 Legend color bubble 0p6 320 million from 2019 Such levels indicate that people are unable to Legend 0p6 below number line labels Any note 0p6 below legend 0 0 2005 2010 2015 2019 2020 eat a healthy balanced a regular basis or that they run out of diet onindent Note uses hanging projected food and at worst go a day or days without eating The highest levels Number of undernourished people millions of food insecurity were found in subSaharan Africa 662 per cent Proportion of undernourished people percentage while prevalence rose fastest in Latin America and Caribbean from Note Shaded areas show lower and upper bounds of the estimated range that considers statistical uncertainty 249 per cent in 2014 to 409 per cent in 2020 The prevalence of Smallscale farmers are disadvantaged on many fronts especially if they are women Smallscale food producers constitute the majority of food producers largescale producers earn two to three times the annual income of in the 37 countries surveyed in some countries they account for up small farmers In almost all countries surveyed households headed to 91 per cent Strengthening the resilience and adaptability of these by men achieve higher labour productivity and earn a larger annual small farmers is critical to reversing the trend towards rising hunger income than those headed by women For example in Bangladesh and reducing the share of people living in extreme poverty Data from households headed by women earn on average only half of the 11 countries show that the average labour productivity of smallscale agricultural income of households headed by men whereas in food producers is lower than that of largescale producers Moreover Bulgaria the difference is threefold The Sustainable Development Goals Report 2021 28"
7,31,"Pandemicrelated shocks are likely to trigger a rise in stunting which already affects more than one in five children Children are considered stunted or chronically malnourished when Proportion of children under age 5 who are affected by stunting 2000 and 20201 they are too short for their age In 20201 22 per cent of children percentage under age 5 worldwide 1492 million suffered from stunting This Oceania 356 414 proportion is down from 331 per cent in 2000 and 244 per cent SubSaharan Africa 323 440 in 2015 These figures are based on the latest estimates but the Central and Southern Asia 477 298 actual number of children affected is likely to be higher due to Northern Africa and Western Asia 262 178 continued constraints in accessing nutritious diets and essential Eastern and SouthEastern Asia 261 134 nutrition services during the pandemic The full impact of the crisis on 180 Latin America and the Caribbean 113 childhood stunting could take years to manifest 54 Europe and Northern America 40 The three regions with the highest stunting prevalence were Oceania Australia and New Zealand 19 23 excluding Australia and New Zealand at 414 per cent subSaharan 331 World Africa 323 per cent and Central and Southern Asia 298 per cent 220 The latter two regions accounted for nearly three quarters of all 0 10 20 30 40 50 60 70 stunted children globally Particular attention needs to be focused 2000 2020 95 per cent confidence intervals on these regions since the pandemic is affecting the most vulnerable Excluding Australia and New Zealand children disproportionately Childhood wasting and overweight are now at alarming levels and are likely to get worse due to COVID19 Wasting is a lifethreatening form of malnutrition measured by low Prevalence of overweight and wasting among children under age 5 20201 percentage weight for height In 20201 wasting affected an estimated 454 million children under age 5 67 per cent overweight affected 389 million Central and Southern Asia 136 27 Oceania 90 80 children in the same age group 57 per cent Wasting will be one SubSaharan Africa 59 40 of the conditions most affected by COVID19 in the short term Northern Africa and Western Asia 51 108 Around 15 per cent more children than estimated may have suffered Eastern and SouthEastern Asia 41 77 from wasting in 2020 due to deterioration in household wealth and Latin America and the Caribbean 13 75 disruptions in the availability and affordability of nutritious food and Europe and Northern America 02 86 Australia and New Zealand 169 essential nutrition services Overweight in children may also rise in some countries where unhealthy food replaced fresh nutritious food World 67 57 and movement restrictions limited opportunities for physical activity 25 20 15 10 5 0 5 10 15 20 25 for long periods of time Childhood wasting and overweight coexist Wasting Overweight 95 per cent confidence intervals in many developing regions at alarmingly high levels For example in Excluding Australia and New Zealand Oceania excluding Australia and New Zealand wasting prevalence Excluding Japan for the wasting estimate was 90 per cent while overweight prevalence was 80 per cent Wasting estimates are for Northern America only due to insufficient < 50 per cent population coverage for Europe Wasting estimates are not available due to insufficient < 50 per cent population coverage With little progress to show over the last 20 years almost a third of women of reproductive age are still anaemic Anaemia is a condition in which the concentration of haemoglobin is Prevalence of anaemia in women aged 15 to 49 2000 and 2019 percentage insufficient to meet the bodys physiologic needs In pregnant women Central and Southern Asia 490 475 it increases the risk of adverse outcomes for both mother and baby SubSaharan Africa 468 407 It may also be an independent risk factor for severe illness from Oceania 344 339 COVID19 In 2019 the global prevalence of anaemia was 299 per cent 367 Northern Africa and Western Asia 318 in women of reproductive age over half a billion women 296 per cent 245 Eastern and SouthEastern Asia 195 in nonpregnant women and 365 per cent in pregnant women Almost 256 Latin America and the Caribbean half of women aged 15 to 49 in Central and Southern Asia suffer 172 132 Europe and Northern America from anaemia Since 2000 the prevalence of this condition globally 146 80 in women of reproductive age has been stagnant The disruption of Australia and New Zealand 88 health services and food systems coupled with economic downturns World 312 299 caused by the pandemic may worsen prevalence Multisectoral efforts 0 10 20 30 40 50 60 and interventions are needed to optimize anaemiareduction efforts 2000 2019 and close the gaps in achieving the global target of reducing anaemia in 95 per cent confidence intervals women of reproductive age by 50 per cent by 2030 Excluding Australia and New Zealand Note Anaemia is defined as the prevalence of haemoglobin concentrations below 110 grams per litre for pregnant women and 120 grams per litre for nonpregnant women 1 The 2020 estimates in this section do not reflect the impact of the COVID19 pandemic since the collection of household survey data on child height and weight were limited that year due to physical distancing measures 29 Goal 2 | Zero hunger"
7,32,"Ensure healthy lives and promote wellbeing for all at all ages Many health indicators were moving in the right direction before the threat of COVID19 emerged Maternal and child health had improved immunization coverage had increased and communicable diseases had been reduced although not fast enough to meet those 2030 targets The pandemic has halted or reversed progress in health and poses major threats beyond the disease itself About 90 per cent of countries are still reporting one or more disruptions to essential Jemila Tofik an extension health worker at Logia Health Centre health services and available data from a few countries show that the in Afar Ethiopia receives a COVID19 vaccination pandemic has shortened life expectancy Not surprisingly the virus is disproportionately affecting disadvantaged groups The pandemic has demonstrated the importance of universal health interventions Governments will need to improve and strengthen basic coverage and multisectoral coordination for health emergency demographic and epidemiological data collection preparedness Moreover to design effective pandemic policy Beyond millions of deaths worldwide the full toll of the COVID19 pandemic on health is not yet known As of June 2021Twototal reported different deaths guide layers from for two and COVID19 reached threeline titles Cumulative number of reported COVID19 deaths as of 8 June 2021 Guides for edge of rightaligned text and bars are uniform and account for 37 million globally Europe space for and Northern America experienced the other languages largest loss at close Swatches 17ofmillion toare full 75followed 50 and 25 Latin America and the by color should All bars12 Caribbean at about be 0p6and million wideCentral and Southern Asia at with 0 spacing within country categories slightly under half a million and 0p2 spacing between country categories If World LDC LDS or SIDS categories are spaced apart For those who 0p6 spacingthe survived fromvirus COVID19 may have lingering health main regions effects including longterm Number disability labels should be insidedue colorto lung bars and 0p3and scarring ideally fromheart edge damage alongIfwith outside leftaligned and 0p3 away mental health issues that could affect individuals Number line 0p2 below bottom bar Stroke 25pt for a prolonged period Indiscriminate use of antibiotics during the Latin America and the Caribbean 1184233 Tick marks 0p3 long Text 0p1 below tick mark pandemic could further Legend increase categories antimicrobial rightaligned 1p0 apartresistance Although 0p3 between color it bubble and Eastern for existing data to reflect this impact the COVID19 is still too earlytext Northern and Legend color bubble 0p6 Africa and South pandemic threatens to reverse years of progress towards improved Western Eastern Legend 0p6 below number line labels Any note 0p6 below legend worldwide health Evidence from countries with reliable and timely Asia Asia Note uses hanging indent 172273 103197 vital statistics indicates that the COVID19 pandemic has sharply Central and Southern Asia SubSaharan Africa shortened life expectancy Europe and Northern America 1698460 490016 85985 A decade of progress in reproductive maternal and child health could be stalled or reversed by the pandemic Substantial progress has been made towards ending preventable child considerably across regions with the largest drops occurring in deaths The global under5 mortality rate was halved from 2000 to Central and Southern Asia from 702 to 237 births per 1000 2019 falling from 76 to 38 deaths per 1000 live births Over the adolescents over the same time period Unfortunately the proportion same period the global neonatal mortality rate death in the first of women of reproductive age 1549 years who have their need 28 days of life fell from 30 to 17 deaths per 1000 live births Still for family planning satisfied with modern contraceptive methods has 52 million children died before their fifth birthday in 2019 with almost stagnated at around 77 per cent since 2015 half of these deaths 24 million occurring in the first month of life In 2020 35 per cent of countries reported interruptions in Globally 83 per cent of births were assisted by skilled health reproductive maternal newborn child and adolescent health professionals including medical doctors nurses and midwives services along with nutrition services This magnitude of disruptions according to data from 2014 to 2020 This represents a 17 per cent could stall or even reverse the progress highlighted above Disruptions increase from 2007 to 2013 The global adolescent birth rate in health services due to the pandemic may have contributed to also showed progress falling from 564 to 412 births per 1000 228000 additional child deaths and around 11000 additional adolescents aged 15 to 19 from 2000 to 2020 Declines varied maternal deaths during 2020 in South Asia alone The Sustainable Development Goals Report 2021 30"
