"ID","PG","txt"
7,1,"The Sustainable Development Goals Report 2021"
7,2,"Contents Foreword 2 View from the pandemic 3 Investing in data 4 Overview 8 Goal 1 No poverty 26 Goal 2 Zero hunger 28 Goal 3 Good health and wellbeing 30 Goal 4 Quality education 34 Goal 5 Gender equality 36 Goal 6 Clean water and sanitation 38 Goal 7 Affordable and clean energy 40 Goal 8 Decent work and economic growth 42 Goal 9 Industry innovation and infrastructure 44 Goal 10 Reduced inequalities 46 Goal 11 Sustainable cities and communities 48 Goal 12 Responsible consumption and production 50 Goal 13 Climate action 52 Goal 14 Life below water 54 Goal 15 Life on land 56 Goal 16 Peace justice and strong institutions 58 Goal 17 Partnership for the Goals 60 Note to the reader 62 Regional groupings 63"
7,3,"The Sustainable Development Goals Report 2021"
7,4,"Foreword The global community is at a critical moment in its pursuit of the Yet with a surge in global solidarity and leadership from the highest Sustainable Development Goals SDGs More than a year into the political level countries can still deliver on the 2030 Agenda and global pandemic millions of lives have been lost the human and the 2015 Paris Agreement on Climate Change A global vaccination economic toll has been unprecedented and recovery efforts so far plan designed and implemented by the countries that can produce have been uneven inequitable and insufficiently geared towards vaccines today or will be able to do so if properly supported is an achieving sustainable development The current crisis is threatening urgent first step in that direction decades of development gains further delaying the urgent transition A recommitment by Governments cities businesses and industries to greener more inclusive economies and throwing progress on the to ensure that the recovery reduces carbon emissions conserves SDGs even further off track natural resources creates better jobs advances gender equality Had the paradigm shift envisioned by the 2030 Agenda A forrecommitment andbytackles growing poverty governments and cities inequalities is businesses a further and imperative industries to ensure that Sustainable Development been fully embraced over the past six years this report shows the availability of highquality data is also recovery reduces carbonAsemissions conserves natural resources creates better jobs adva the world would have been better prepared to face this crisis with critical helping decision makers to understand where investments gender equality and tackles growing poverty and inequalities is a further imperative As stronger health systems expanded social protection coverage the can have the greatest impact but improved data collection will not report shows the availability of highquality data is also critical helping decisionmakers resilience that comes from more equal societies and a healthier happen without increased data financing from both international and understand where natural environment Regrettably the SDGs were already off track investments can have the greatest impact but improved data collection domestic resources even before COVID19 emerged Progress had been not happen without increased data financing from both international and domestic resour made in poverty The challenges are immense but there are also reasons for hope reduction maternal and child health access to electricity and gender The COVID19 crisis demonstrated inspiring community resilience equality but not enough to achieve the Goals by 2030 InThe challenges other vital are immense but there are also reasons for hope The COVID19 highlighted the Herculean work by essential workers in myriad demonstrated inspiring areas including reducing inequality lowering carbon emissions and community resilience highlighted the herculean work by essentia fields and facilitated the rapid expansion of social protection the workers in myriad fields tackling hunger progress had either stalled or reversed of digitalthe and facilitated acceleration rapid expansion transformation of social protection and unprecedented worldwide the acce of digital As the pandemic continues to unfold The Sustainable transformation Development and unprecedented collaboration worldwide on the development collaboration A brighteron of vaccines the isdevelopment future Goals Report 2021 outlines some significant impacts in manyA vaccines that future brighter areas is possible possible We must useWethemust crisis use the crisis to transform ourto transform world deliver onour theworld de are already apparent The global extreme poverty the rose onrate 2030forAgenda the and keep 2030 our promise Agenda to current and keep our promise and future to current andgenerations future generations first time in over 20 years and 119 to 124 million people were pushed back into extreme poverty in 2020 There is a risk of a generational catastrophe regarding schooling where an additional 101 million children have fallen below the minimum reading proficiency level potentially wiping out two decades of education gains Women have faced increased domestic violence child marriage is projected to rise after a decline in recent years and unpaid and underpaid care work is António Guterres increasingly and disproportionately falling on the shoulders of women and girls impacting educational and income opportunities and health António Guterres Notwithstanding the global economic slowdown concentrations of SecretaryGeneral of the United Nations major greenhouse gases continue to increase With the global average temperature reaching about 12°C above preindustrial levels the climate crisis has well and truly arrived and its impacts are being felt across the world The pandemic has also brought immense financial challenges especially for developing countries with a significant rise in debt distress and dramatic decreases in foreign direct investment and trade The Sustainable Development Goals Report 2021 2"
7,5,"View from the pandemic stark realities critical choices As we enter the second year of the COVID19 pandemic it is together to develop lifesaving vaccines and treatments in record abundantly clear that this is a crisis of monumental proportions with time The pandemic has sped up the digital transformation of catastrophic effects on peoples lives and livelihoods and on efforts to Governments and businesses profoundly changing the ways in which realize the 2030 Agenda for Sustainable Development Historically we interact learn and work pandemics have served as catalysts for political economic and Transformational changes are needed and the SDGs provide social change and that still holds true today The year 2021 will be the road map The crisis demonstrates the interdependency and decisive as to whether or not the world can make the transformations interlinkages among the various dimensions of sustainability from needed to deliver on the promise to achieve the SDGs by 2030 with health wellbeing and social and economic prosperity to climate and implications for us all ecosystems To address the vulnerabilities exposed by the pandemic The Sustainable Development Goals Report 2021 uses the latest available Governments and the international community should make data and estimates to reveal the devastating impacts of the crisis on structural transformations and develop common solutions guided by the SDGs and point out areas that require urgent and coordinated the SDGs These include significantly strengthening social protection action The report was prepared by the United Nations Department systems and public services including health systems education of Economic and Social Affairs in collaboration with more than water sanitation and other basic services increasing investments in 50 international agencies science technology and innovation creating fiscal space in developing Years or even decades of progress have been halted or reversed countries taking a greeneconomy approach and investing in clean In 2020 the global extreme poverty rate rose for the first time in energy and industry and transitioning to sustainable food systems over 20 years Hundreds of millions of people were pushed back Investing in data and information infrastructure is critical The into extreme poverty and chronic hunger The COVID19 pandemic pandemic has taught us that weaknesses in data and information has interrupted one or more essential health services and poses systems present an added and enormous challenge to decision major health threats beyond the disease itself It has wreaked havoc makers A year into the pandemic only about 60 countries had data worldwide on childrens learning and wellbeing and women have on COVID19 infection and death rates that could be disaggregated by suffered a disproportionate share of job losses and increased care age and sex and that were publicly accessible These data deficiencies work at home have serious consequences for peoples lives Policies programmes The pandemic has exposed and intensified inequalities within and and resources aimed at protecting people during this challenging among countries The poorest and most vulnerable people have a time will inevitably fall short without the evidence to focus and hone greater risk of becoming infected by the virus and bear the brunt of interventions Investing in data and information systems is not money the economic fallout The crisis has threatened the livelihoods of 16 wasted Statistical offices around the world have embraced innovative billion workers in the informal economy The collapse of international approaches and forged partnerships improving the availability of data tourism disproportionally affects small island developing States And for evidencebased decisions Increased investments in national data vast inequities exist in vaccine distribution as of 17 June 2021 around and statistical systems and the mobilization of additional international 68 vaccines were administered for every 100 people in Europe and and domestic resources will be imperative if we are to build back Northern America compared with fewer than 2 in subSaharan Africa better from the crisis and accelerate implementation of the SDGs The climate crisis the biodiversity crisis and the pollution crisis Building back better requires effective multilateralism and the full persist despite the pandemic Concentrations of major greenhouse participation of all societies This global crisis demands a shared gases continue to increase despite the temporary reduction in global response In the face of the many challenges we face a unified emissions in 2020 related to lockdowns and other COVID19 response vision of coherent coordinated and comprehensive responses measures The world remains woefully off track in meeting the Paris from the multilateral system is more important than ever Since the Agreement Biodiversity is declining and terrestrial ecosystems are pandemic affects everyone everywhere the implementation of being degraded at alarming rates Around the world 1 million plastic solutions requires action and participation from all sectors of society drinking bottles are purchased every minute and 5 trillion singleuse including Governments at all levels the private sector academia civil plastic bags are thrown away each year society and individuals youth and women in particular The COVID19 pandemic serves as a mirror for the world It reflects We are at a critical juncture in human history The decisions we make deeply rooted problems in our societies insufficient social protection and actions we take today will have momentous consequences for weak public health systems and inadequate health coverage structural future generations Lessons learned from the pandemic will help us inequalities environmental degradation and climate change rise to current and future challenges Let us seize the moment to make this a decade of action transformation and restoration to achieve the Resilience adaptability and innovation bring us optimism In the face SDGs and make good on the Paris Climate Agreement of tremendous challenges many Governments the private sector academia and communities have demonstrated quick responses remarkable creativity and new forms of collaboration Between 1 February and 31 December 2020 Governments around the world announced more than 1600 new social protection measures in Liu Zhenmin response to the crisis Scientist across the globe have been working UnderSecretaryGeneral for Economic and Social Affairs 3 View from the pandemic"
7,6,"Investing in data to save lives and build back better Since the start of the COVID19 pandemic policymakers and business on how COVID19 is affecting the population through methods leaders have routinely had to make timesensitive decisions many of such as webscraping Google mobility data and the introduction of which have lifeordeath consequences Yet even basic data to guide new surveys Together with partners the office set up a COVID19 decisionmaking on health the society and the economy are Infections Survey in a matter of days which has since become an often lacking The pandemic has brought to the forefront the critical indispensable source of data on the pandemic As of June 2021 importance of such data It has also accelerated the transformation interviewers had covered 24 million households and performed 46 of data and statistical systems and how the public perceives and uses million swab tests The survey detected an uptick of new infections that information As policy and decision makers were pressuring and the prevalence of the socalled Delta variant In midJune British data providers for more uptodate and accurate information national Prime Minister Boris Johnson delayed by a month his plans to lift the statistical offices NSOs and their partners stepped up to the last COVID19 restrictions The delay in reopening was intended to buy challenge They forged new collaborations and leveraged alternative additional time for the health department to intensify its vaccination data solutions while increasing efforts to protect data privacy and programme which was also informed by data showing that new confidentiality infections were largely driven by those who were not fully vaccinated As the pandemic continues to unfold and the world moves further In Ghana the Statistical Service responded successfully to the sudden off track in meeting the 2030 SDG deadline timely and highquality increase in data demand When COVID19 hit suddenly the appetite data are more essential than ever Indeed data are being widely for numbers grew says Omar Seidu the head of demographic recognized as strategic assets in building back better and accelerating statistics and SDG coordinator at the Ghana Statistical Service In the implementation of the SDGs What is needed now are new addition to the number of new COVID19 cases other important investments in data and information infrastructure as well as human questions were raised such as which regions were densely populated capacity to get ahead of the crisis and trigger earlier responses how many people lived in crowded situations and which parts of the anticipate future needs and design the urgent actions needed to country had no water for handwashing realize the 2030 Agenda for Sustainable Development The Ghana Statistical Service was able to guide policymakers on crisis response and service delivery by bringing together a wide Responding to an unprecedented demand for data range of data and disseminating them through a central COVID19 Despite major disruptions to statistical operations many NSOs have data hub supported by a joint project on SDG monitoring with the adapted quickly They have adopted new methods and tools to come United Nations and the Government of the United Kingdom the up with data and have played a central role in Governments COVID UNSDFCDO project The Ghana Statistical Service also helped 19 responses As of September 2020 82 per cent of NSOs were monitor lockdown compliance through mobility data gathered in involved in data collection on COVID19 and its impacts some through partnership with a cellphone carrier The crisis expanded the role innovative methods such as online and telephonebased surveys as of statisticians in the country In the past our role was more or well as the use of administrative credit card and scanner data less limited to data collection says Mr Seidu Ministers and other In the United Kingdom of Great Britain and Northern Ireland the Office decision makers now want us to have a seat at the table not only for for National Statistics has responded to an urgent need for information COVID19 task forces but on development policy as a whole The Sustainable Development Goals Report 2021 4"
7,7,"Advancing progress on data for SDG monitoring and improving The most recent year available weighted average by indicator by Goal peoples lives 2019 Considerable progress has been made on the availability of 2018 internationally comparable data on the SDGs The number of indicators included in the global SDG database increased from 115 in 2017 2016 to around 160 in 2019 and 211 in 2021 2016 The advancements in data availability have had a direct impact on peoples lives Sugarmaa Batjargal was born on a cold February day 2015 in Mongolias AlagErdene District She was a healthy infant thanks 2014 to the midwife who visited her mother during pregnancy and taught G1 G2 G3 G4 G5 G6 G7 G8 G9 G10 G11 G12 G13 G14 G15 G16 G17 her about proper nutrition and ways to care for a baby in harsh Note The data in this chart are not comparable with those presented in The Sustainable weather conditions These prenatal and neonatal services were put in Development Goals Report 2020 due to changes in the SDG indicator framework and the calculation method The SDG indicators framework was comprehensively reviewed and place because of data that identified the region as high risk for child revised in 2020 resulting in 36 major changes to indicators in the form of replacements revisions additions and deletions mortality Between 1990 and 2019 the countrys neonatal mortality rate dropped significantly from 30 to 8 deaths per 1000 live births Data timeliness has also been a challenge for SDG monitoring For Only with the right data can Governments know which children are instance the latest data point available for climate change indicators most at risk and how best to reach them Goal 13 is around 2015 The average of the latest available year for data on poverty Goal 1 and education Goal 4 is around 2016 Identifying data gaps to achieve the SDGs For every success story like Sugarmaas there are many other stories Addressing the vulnerability of data and information infrastructure of deprivation and inequity the children who are not reached simply COVID19 has further exposed the vulnerability of national data and because there is no information about them A lack of data severely information infrastructures A seemingly straightforward question limits a countrys ability to reach children and their families to such as How many people have died from COVID19 cannot be ensure that they have the services opportunities and choices answered in many countries due to the absence of a complete and they deserve to live life to the fullest An average of 74 per cent of wellfunctioning civil registration system Globally only 62 per cent of childrelated SDG indicators either have insufficient data or show countries had a death registration system that was at least 75 per cent insufficient progress to meet the global targets by 2030 complete in 20152019 the share in subSaharan African countries Despite improvements big data gaps still exist in all areas of the was less than 20 per cent SDGs in terms of geographic coverage timeliness and the level During the pandemic many countries also struggled with interruptions of disaggregation required Intensified efforts need to be made in data collection caused by lockdown measures Facetoface survey to fill those gaps An analysis of the indicators in the Global SDG interviews were often stopped and statistical services reduced In Indicators Database reveals that for 5 of the 17 Goals fewer than places where data and information infrastructure did not permit the half of 193 countries or areas have internationally comparable data use of alternative data collection tools such as online or telephone This lack of countrylevel data is particularly worrisome for Goal based surveys data production was more severely affected Countries 13 climate action where on average only about 1 in 6 countries with integrated and wellfunctioning household survey systems were have data available Countrylevel data deficits are also significant in more resilient In a compilation of national COVID19 impact surveys areas related to sustainable cities and communities Goal 11 peace maintained by the InterSecretariat Working Group on Household justice and strong institutions Goal 16 sustainable production and Surveys only 43 per cent of around 180 countries used a recent consumption Goal 12 and gender equality Goal 5 Whats more household survey as a sampling frame for telephone interviews the lockdown measures implemented to control the spread of COVID19 remaining countries lacked a usable sample frame have hindered data collection efforts for much of 2020 widening gaps Important operations such as population censuses were seriously in the capacity of countries to report on many of the indicators disrupted around the world A survey of NSOs showed that about 42 per cent of countries have had to postpone censuses scheduled for 2020 or 2021 for at least one year European countries many of which Proportion of countries or areas with available data by Goal percentage unt for typically use population registers rather than traditional censuses 100 were less affected Only 13 per cent of the European country censuses 80 were disrupted versus 60 per cent in Africa 60 Proportion of countries that have postponed their censuses scheduled for 2020 or 2021 40 ge Africa 60 20 Americas 56 Asia 40 le and 0 G1 G2 G3 G4 G5 G6 G7 G8 G9 G10 G11 G12 G13 G14 G15 G16 G17 Oceania 25 Note The data in this chart are not comparable with those presented in The Sustainable Europe 13 Development Goals Report 2020 due to changes in the SDG indicator framework and the calculation method The SDG indicators framework was comprehensively reviewed and World 42 revised in 2020 resulting in 36 major changes to indicators in the form of replacements revisions additions and deletions 0 10 20 30 40 50 60 5 Investing in data to save lives and build back better"
